year,course_name,course_description,reference
2024,"Specialist Diploma in Technology, Innovation & Analytics for Financial Sector Professionals","This course aims to equip the participants with future-enabled skillsUpon successful completion of the course, participants will be able:To learn and apply new Technologies & Tools used in the financial sectorTo use Data Analytics to improve on Decision-Making ProcessesTo adopt a Human-Centric approach to Innovation and Customer EngagementTo learn and manage Cyber Risks faced by financial institutionsTo understand Disruptive Fintech Innovations to the financial sector",https://www.sp.edu.sg/pace/courses/all-courses/course-details/specialist-diploma-in-technology-innovation-analytics-for-financial-sector-professionals
2024,Diploma (Conversion) in Maritime Business Management,"Singapore has claimed the top spot in a survey as the world’s leading maritime cities for the 3rd consecutive time (The Straits Times, 2017). Singapore was also ranked first in the report's 2015 and 2012 surveys that were conducted by Norwegian consultancy firm Menon Economics. This year, Singapore was ranked number one in three categories: shipping, ports and logistics, and attractiveness and competitivenessWork on the Tuas Port, which will be twice the size of Ang Mo Kio town, will also be opened progressively from 2021. When fully completed by 2040, it will be able to handle up to 65 million twenty-foot equivalent units (TEUs) of cargo a year, more than double what the port handled in 2016.In order to continue to maintain Singapore’s position as a global port hub and a premier international maritime centre, there is a need to establish a highly skilled and specialised workforce. Our Diploma (Conversion) in Maritime Business Management course is designed to equip the students with the necessary knowledge and skills to meet the demand of this industry.Participants are required to bring computer notebook when attending lessons, as you may need it to access the e-learning materials, writing reports, etc.The course is designed is to equip non-maritime graduates with the knowledge and skills in shipping operations and logistics/offshore management so that they can join the maritime industry as senior executives/junior managers and perform their jobs with a greater level of competence and understanding.",https://www.sp.edu.sg/pace/courses/all-courses/course-details/diploma-(conversion)-in-maritime-business-management
2024,Diploma (Conversion) in Supply Chain Management and Innovation,"This course aims to equip students with not only the foundational knowledge and skills, but also elements of innovation in logistics and supply chain management, so that they can be effective in meeting new demands and challenges of the marketplace.",https://www.sp.edu.sg/pace/courses/all-courses/course-details/diploma-(conversion)-in-supply-chain-management-innovation
2024,Specialist Diploma in Professional Accounting & Technology,"This course seeks to provide deepening of technical knowledge and skills required by the accountancy profession (in areas of International Financial Reporting Standards, auditing and taxation) as well as finance and technological skills needed by the profession. With deepening of the accounting skills coupled with technological skills, the graduate would be better equipped for the accounting sector.",https://www.sp.edu.sg/pace/courses/all-courses/course-details/specialist-diploma-in-professional-accounting-technology
2024,Specialist Diploma in Robotics & Automation (Advanced Robotics Application),"The SP Mechanical & Aeronautical School is pleased to introduce our Specialist Diploma in Robotics & Automation (Advanced Robotics Application) offering comprehensive and practical programs that provide relevant technical knowledge and skillsets in the field of robotics and automation in support of our nation’s drive towards Industry 4.0 transformation.As our industry sectors move up the value chain through the adoption of advanced manufacturing, the role of robotics and automation is fast evolving where it is no longer sufficient to simply maximize efficiency but also to be able to adapt swiftly to changing demands and requirements. Smart robotics systems and flexible automation are the engines as well as enablers in this transformation journey.In view of the foreseeable need and demand for people with the domain knowledge and competencies in smart robotics & automation, join us today for this 12-month stackable course and be equipped with future ready skillsets as a specialist in this emerging field!This course aims to equip trainees with the following critical knowledge and skills in Robotics & Automation:To provide trainees with hands-on practical experience in Robotics & Automation fundamentals.To provide relevant technical knowledge and skillsets in the field of advanced robotics application to meet the current and future requirements of advanced manufacturing industry.",https://www.sp.edu.sg/pace/courses/all-courses/course-details/specialist-diploma-in-robotics-automation-(advanced-robotics-application)
2024,Specialist Diploma in Robotics & Automation (Smart Intelligence),"The course aims to equip trainees with the following critical knowledge and skills in Robotics & Automation:To provide trainees with hands-on practical experience in Robotics & Automation fundamentals.To provide trainees with knowledge and skills in AI, Internet-of Things (IoTs), Machine Learning (ML) & Cloud Analytics in developing Intelligent Robotics applications.",https://www.sp.edu.sg/pace/courses/all-courses/course-details/specialist-diploma-in-robotics-automation-(smart-intelligence)
2024,Specialist Diploma in Workplace and Career Counselling,"This Specialist Diploma supports the upskilling needs of the current workforce in the human resource industry. Given the rapidly changing employment landscape in Singapore, workplace and career counselling is important as it provides employees in an organisation with socioemotional support to improve their psychological wellbeing. It also helps employees develop greater self-awareness to discover their career interests and preferences, and assess work motivations based on their strengths and capabilities to enable higher employability.Additionally, in recent years, awareness about mental health at the workplace has grown, both in the public and private sector. More companies have also adopted an Employee Assistance Programme (EAP) as part of their welfare benefits. This typically involves access to individual counselling sessions that employees can claim for, as well as other services such as mental health workshops. In view of this, this specialist diploma hopes to develop more managers and para-counsellors in the public and private sectors to be equipped with the hands-on knowledge of the contemporary tools and micro skills used in workplace counselling to support employees in any work context.",https://www.sp.edu.sg/pace/courses/all-courses/course-details/specialist-diploma-in-workplace-and-career-counselling
2024,DIPLOMA IN BORDER AND SECURITY MANAGEMENT,"The proposed course seeks to equip students with the knowledge and skills to carry out their job roles under the private and auxiliary police career track under the security industry in the areas of:border security functions,information management,security risk management,supervisory and business management, andtechnology trends and communication",https://www.sp.edu.sg/pace/courses/all-courses/course-details/diploma-in-border-security-management
2024,Specialist Diploma in Digital Marketing and Analytics,"The course is designed to facilitate life-long learning and bite-size acquisition of digital marketing and analytics skills to responsively meet the needs of working professionals. At the end of the course, the students will be able to:Understand and apply varied digital marketing strategies to different business models in reaching overall marketing objectives.Explore the many possibilities of Digital Marketing in streamlining business processes, support overall marketing objectives and to add brand value to an organization.Equip students with the skills and knowledge to analyze and optimize website performance with the use of web analytics software and methodologies. Students will learn to develop, optimize and execute search engine marketing plans and campaigns. Drive strategy for search engine marketing initiatives ensuring that revenue, budget, ROI and other business goals are met.Equip students with online tools and social media outreach for viral marketing and to foster interaction, engagement and discussion regarding the company’s products and services.Analyse unstructured textual data on social media platforms to gain insights to support business decision making as well as provide recommendations.",https://www.sp.edu.sg/pace/courses/all-courses/course-details/specialist-diploma-in-digital-marketing-analytics
2024,Specialist Diploma in Data Science (Predictive Analytics),"The need to handle, prepare, analyse and model data of varied structures is prevalent in the modern day industrial setting including industry sectors such as banking and finance, insurance, healthcare, telecommunications, design and manufacturing, and retail. This course provides graduates with fundamental skills in statistical analysis and predictive analytics that are required by jobs that involve managing, analysing and modelling data and extracting information that is useful to the business.The objectives of the Specialist Diploma in Data Science (Predictive Analytics) are to provide foundational training in the fundamental concepts and methods of statistics and programming for data science, as well as in specialized skill sets in the area of statistical modelling and prediction. Graduates of the course will be competent in preparing data, performing statistical analysis, building and deploying predictive models and quantifying risks associated with the prediction.",https://www.sp.edu.sg/pace/courses/all-courses/course-details/specialist-diploma-in-data-science-(predictive-analytics)
2024,Specialist Diploma in Enhanced Human Resource Skills,"The course is designed to:Provide students with the knowledge of some of the leading HR technologies and tools to improve HR efficiency and effectiveness across the various HR functions.Provide students with a working knowledge on design thinking tools to be more user-centric in dealing with HR challenges around systems, processes, procedures and policies.Equip students with the skills to utilise HR analytics tools and techniques to assess and solve HR and business challenges, such as talent acquisition, workforce development and productivity, and employee engagement.Equip students with positive psychology knowledge and skills to engage others, maximise employees’ potential through coaching, and manage work relationships and performance in an organisation.",https://www.sp.edu.sg/pace/courses/all-courses/course-details/specialist-diploma-in-enhanced-human-resource-skills
2024,Specialist Diploma in Network Security,"Rapid advances in Internet technologies and applications, and the subsequent proliferation of economic activity on the Internet have ushered in the digital age where virtually every organization wants to leverage this massive and ubiquitous public technology infrastructure. However, many companies have overlooked the need for cyber security. With online threats becoming more sophisticated in recent years, cyber security risks pose a challenge to many companies. The global threat of malware and hackers has never been higher, and the shortage of experts who can fight them has never been more acute. Rising demand for cybersecurity-related skillsets, in part to support the nation's Smart Nation vision, means that there is an urgent need for personnel trained in Network Security.In the survey on Infocomm Media Manpower conducted by the Infocomm Media Development Authority (IMDA) in 2018, IT Security Operations Analysts/Engineers were identified as critical emerging Tech specialist roles. Enterprises have projected that the demand for such specialists will grow by 4,700 in the period of 2018 – 2020.Cisco Consultant, Mr Wong Kwok Foong, has this to say about the importance of securing networks, “As we are entering an era of connecting the unconnected, utilizing more data than ever for work, safety and play, the network has become an integral part of any emerging technology. However, these technologies will only work as designed when they are not compromised by security threats. Expertise in the areas of networking and security are very important in today’s digital market to help enterprises gain competitive advantage through technology adoption, given the dynamic nature of the cybersecurity landscape.”The Specialist Diploma in Network Security offered by the School of EEE seeks to address the industrial demand for such specialists. The course intends to train and equip students with the practical knowledge and skills of Network Security.The course will cover the following areas:Network SecurityFirewall & Intrusion PreventionWireless Network & SecurityNetwork Analysis & ForensicsStudents will be enrolled into the Cisco Networking Academy and take modules in the CCNA -Security course.This course aims to train students in the areas of Network Security, Firewall & Intrusion Prevention, Wireless Network & Security, as well as Network Analysis & Forensics. Students will learn the fundamental concepts of Network Security in order to identify the threats and vulnerabilities of computer systems and networks and recommend appropriate counter measures like Firewall and Intrusion Prevention System (IPS).The Wireless Network and Security module provides students with a complete foundation of knowledge in Wireless Networking and the concepts of wireless security to prevent unauthorised access of wireless networks. Students will also be exposed to network analysis & forensics skills to understand the nature of network security breaches and exploits.",https://www.sp.edu.sg/pace/courses/all-courses/course-details/specialist-diploma-in-network-security
2024,Diploma in Maritime & Offshore Management,"This one-year programme is to enable participants who do not possess maritime qualification to take up a career in the maritime and offshore industry. It aims to give the participants a greater level of understanding in shipping, logistics and offshore operations and management. The participants will be able to perform their jobs with a greater level of competence and understanding after completing this course.Participants are required to bring computer notebook when attending lessons, as you may need it to access the e-learning materials, writing reports, etc.This course aims to equip non-maritime students with the theoretical knowledge and principles in the operation and management of shipping, logistics and offshore businesses. With this knowledge, they can apply themselves effectively to broaden the scope of their job function and keep themselves abreast with the rapidly changing industry practices.",https://www.sp.edu.sg/pace/courses/all-courses/course-details/diploma-in-maritime-and-offshore-management
2024,Advanced Diploma in Process Control and Instrumentation,The primary objective of this Advanced Diploma course is to provide working adults with the necessary skills and knowledge relevant to the Process Control and Instrumentation industry. The specialised technical modules will give a deeper understanding of knowledge and skill sets required for a graduate to work in the Process Control industry.,https://www.sp.edu.sg/pace/courses/all-courses/course-details/advanced-diploma-in-process-control-instrumentation-(revamped-curriculum)
2024,Advanced Diploma in Power System Engineering,"This course aims to upgrade the knowledge and skills of practising engineers and technologists involved in the operation, planning, design, maintenance, protection, control and management of power systems. Students will also learn about computer applications and the use of computer systems for the analysis, protection, control, planning and utilisation of electrical power.",https://www.sp.edu.sg/pace/courses/all-courses/course-details/advanced-diploma-in-power-system-engineering
2024,Specialist Diploma in Air-Conditioning and Energy Sustainability,"The Singapore Polytechnic, School of Mechanical and Aeronautical Engineering is pleased to introduce our new Specialist Diploma in Air-Conditioning & Energy Sustainability. This course aims to help working personnel in the areas of Air-Conditioning and Mechanical Ventilation (ACMV) systems, building facility management, mechanical services and energy sustainability to upgrade their knowledge and skills to be aligned with latest industrial needs. This part-time evening course can be completed in one year.The following are the objectives of the course:To provide a comprehensive course that caters to the needs of applicants who are seeking to attain the relevant knowledge and skills in energy management and sustainability for ACMV facility.To support growing demand for skills and knowledge for ACMV system designs for built environment industry.To facilitate students with energy modelling skills by using latest Integrated Environmental Solutions (Virtual Environment) or (IES VE) software which is one of the main software tools industry is using for energy modelling for buildings.To equip students with skills and knowledge on Integrated Building Management System to comprehend and achieve automatic and efficient control of the ACMV facilities.To equip students with the industry relevant knowledge and skills of Green Mark for energy efficiency and sustainability building facilities.",https://www.sp.edu.sg/pace/courses/all-courses/course-details/specialist-diploma-in-air-conditioning-energy-sustainability
2024,Diploma in Engineering (Advanced Manufacturing),"As Singapore moves towards the Fourth Industrial Revolution (known as Advanced Manufacturing* in Singapore), many new high-valued jobs will be created to support the digital transformation that many companies are undertaking to improve the digitalization of process. Manufacturing has been a key engine for the Singapore’s economy, accounting for about a fifth of its gross domestic product. As this trend is expected to continue, the SP School of Mechanical & Aeronautical Engineering is pleased to introduce our Diploma in Engineering (Advanced Manufacturing). This course will better prepare our working adults with the necessary skills and knowledge for their future career advancement and to meet the future demands for the necessary skillsets targeting advanced manufacturing.Participants are required to bring computer notebook when attending lessons, as you may need it to access the e-learning materials, writing reports, etc.*Discover more on Singapore’s Smart Industry Readiness Index (SIRI) and Advanced Manufacturing.*Discover more on Industry 4.0This course aims to provide the students with a strong foundation in Manufacturing and Mechanical Technology with an emphasis on emerging skillsets needed for i4.0/Advanced Manufacturing and to enable them to understand, analyse and solve daily problems at work as an Associate Engineer/Assistant Engineer. In addition, it also aims to equip the students with the necessary skillsets to take on the future challenges in Advanced Manufacturing developments. The modules have been carefully selected to address the necessary skills and knowledge required by a person who aspires career advancement in manufacturing.",https://www.sp.edu.sg/pace/courses/all-courses/course-details/diploma-in-engineering-(advanced-manufacturing)
2024,Diploma in Engineering (Aerospace),This course provides continual academic and career progression pathways for CET participants. It will also provide participants with the knowledge and skills essential to take on the job responsibilities in the Aerospace industry.,https://www.sp.edu.sg/pace/courses/all-courses/course-details/diploma-in-engineering-(aerospace)
2024,Diploma in Engineering (Computer Network & Systems),"Students will:• Understand the concepts in data communication and the role of computer network equipment like routers and switches.• Design, configure and troubleshoot computer networks and servers• Design and development of info-comm services, computer/embedded systems and IoT systems",https://www.sp.edu.sg/pace/courses/all-courses/course-details/diploma-in-engineering-(computer-network-systems)
2024,Diploma in Engineering (Mechanical Technology),"This Diploma course in Engineering (Mechanical Technology) will comply with the revised CET Diploma Framework. The revised CET Diploma Framework specifies that each CET diploma course consists of five 180-hour modular certificates (MC). Each MC is designed to be completed in one academic semester and is made up of 180 contact hours.Participants are required to bring computer notebook when attending lessons, as you may need it to access the e-learning materials, writing reports, etc.The main objective of this course is to provide a broad-based Mechanical Engineering education to enable technologists to design, build, operate and maintain equipment ranging from simple devices to sophisticated machinery. The modules have been carefully selected to address the necessary skills and knowledge required by a person who aspires career advancement.This Diploma does not lead to any professional accreditation/licensing for the vocations in the industries outlined.",https://www.sp.edu.sg/pace/courses/all-courses/course-details/diploma-in-engineering-(mechanical-technology)
2024,Diploma in Applied Science (Industrial Chemistry and Life Sciences),"The Part-time Diploma in Applied Science (Industrial Chemistry and Life Sciences) (DACS) aims to prepare working adults with the necessary knowledge and skills for future career advancement and to meet the future demands for technicians in the Energy and Chemicals Sector. It is a broad-based applied science education with emphasis on chemistry, chemical processes, life science modules and laboratory skills.This course provides training to work as a competent laboratory analyst and essential skills to execute tasks related to process technicians.",https://www.sp.edu.sg/pace/courses/all-courses/course-details/diploma-in-applied-science-(industrial-chemistry-and-life-sciences)
2024,Diploma in Applied Science (Industrial Chemistry and Life Sciences),"The Part-time Diploma in Applied Science (Industrial Chemistry and Life Sciences) (DACS) aims to prepare working adults with the necessary knowledge and skills for future career advancement and to meet the future demands for technicians in the Energy and Chemicals Sector. It is a broad-based applied science education with emphasis on chemistry, chemical processes, life science modules and laboratory skills.This course provides training to work as a competent laboratory analyst and essential skills to execute tasks related to process technicians.",https://www.sp.edu.sg/pace/courses/all-courses/course-details/diploma-in-applied-science-(industrial-chemistry-and-life-sciences)
2024,DIPLOMA IN BUSINESS PRACTICE (ACCOUNTING),"The course aims to promote life-long learning by providing an opportunity for anyone without a tertiary qualification to upgrade themselves academically, and even possibly pursue higher academic qualifications from other institutes of higher learning or professional qualification from professional accountancy bodies after graduation.As such, this course seeks to deepen the skills and knowledge of adults already working in the accounting related jobs, as well as provide opportunities for students to pursue a career in accountancy and to progress in the profession via multiple pathways and lifelong learning.",https://www.sp.edu.sg/pace/courses/all-courses/course-details/diploma-in-business-practice-(accounting)
2024,Diploma in Business Practice (Business Management),"The objective of the part-time diploma is to provide a broad-based business education with emphasis on key business functions as well as communication, information technology and problem-solving skills. The modules have been carefully selected to address the necessary skills and knowledge required by a person who aspires career advancement and further studies. Graduates will become better-equipped in serving the needs of both small and medium sized enterprises as well as larger organisations in both the private and public sectors",https://www.sp.edu.sg/pace/courses/all-courses/course-details/diploma-in-business-practice-(business-management)
2024,Diploma in Business Practice (Human Capital),"The course aims to promote life-long learning by providing an opportunity for anyone without a tertiary qualification to upgrade themselves academically.As such, this course seeks to provide a broad-based business education with specialisation in human resource, as well as provide opportunities for students who aspire a career pathway in the HR sector to acquire the relevant HR knowledge and skills.",https://www.sp.edu.sg/pace/courses/all-courses/course-details/diploma-in-business-practice-(human-capital)
