year,course_name,course_description,reference
2024,"Specialist Diploma in Power System Planning, Operation and Protection","Electrical power plays an essential role in the development of a nation. A reliable and economic supply of electrical power is essential for the effective and productive operation of Singapore’s industries. This can only be achieved by having an efficient and well-planned power system operated by skilful operators. This demands engineers with the knowledge of power system planning, operation and protection.This course provides participants with relevant knowledge and skills training to perform planning, design, operation, protection and management of electrical power systems.",https://www.sp.edu.sg/pace/courses/all-courses/course-details/specialist-diploma-in-power-system-planning-operation-protection
2024,Work-Study Certificates leading to part-time Diploma in Design (Interior Design),"The course aims to provide students with knowledge in Interior Design, as well as key technical knowledge and skills relevant for the Interior Design Industry.The course is set to provide students with focused skills relevant in the application of work-study setup ranging from Spatial Design, Project Management, Materials, Detailing & Costing as well as BIM for Interior Design.",https://www.sp.edu.sg/pace/courses/all-courses/course-details/work-study-certificates-leading-to-part-time-diploma-in-design-(interior-design)
2024,Work-Study Post-Diploma (Specialist Diploma in Data Science (Data Engineering)),"To equip students with knowledge and skills on Statistics and Programming for Data Science.To equip students with knowledge and skills on setting up databases and data warehouses for organisations.To equip students with knowledge and skills as to create and manage Extract, Transform & Load (ETL)(4) pipelines for Big Data.",https://www.sp.edu.sg/pace/courses/all-courses/course-details/work-study-post-diploma-(specialist-diploma-in-data-science-(data-engineering))
2024,Diploma in Infocomm and Digital Media (Cyber Security),"As Singapore strives to become a Smart Nation, cyber security becomes more important as more data and functions are put into computers, handphones, networks and other devices. The 2.5-year part-time Diploma in Infocomm & Digital Media (Cyber Security) course will cover different areas of cyber security.The Diploma in Infocomm & Digital Media (Cyber Security) aims to train students to work competently in the area of cyber security, particularly in the area of penetration testing/vulnerabilities assessment and incident response and management.",https://www.sp.edu.sg/pace/courses/all-courses/course-details/diploma-in-infocomm-digital-media-(cyber-security)
2024,Specialist Diploma in Building Information Modelling Management,"BIM is identified as one of the key technology drivers by the Building and Construction Authority (BCA) to improve work productivity and level of integration across the various disciplines in the Built Environment (BE) Industry. The School of Architecture and the Built Environment (ABE) is pleased to introduce the Specialist Diploma in Building Information Modelling Management to align with the vision of BCA. This course is offered to applicants who are keen to further their education in Building Information Modelling (BIM) knowledge as part of the journey to being a life-long learner. This course will equip applicants with the ability to facilitate and reinforce their organisation’s BIM capabilities and deliver building and construction projects using the various BIM 3D, 4D and 5D platforms.This course is offered to both Work-Study Programme (WSP) and non-WSP applicants.This is a part-time evening course and it can be completed in a duration of one year. Applicants are required to bring their computer notebook when attending lessons, as they may need it to access the e-learning material, write reports, etc.The Specialist Diploma in Building Information Modelling Management course is designed to boost the level of expertise in Singapore and deepen the skills and knowledge of applicants in BIM management. This is achieved through institutional-based learning at SP and supplemented by the on-the-job (OJT) training for WSP applicants.",https://www.sp.edu.sg/pace/courses/all-courses/course-details/specialist-diploma-in-building-information-modelling-management
2024,"Specialist Diploma in Coaching, Guidance and Facilitation Skills","The Specialist Diploma in Coaching, Guidance & Facilitation Skills aims to upskill and professionalize current job roles for the Adult Educators in the Social Service sector and Care Economy. The programme will help to retain and upskill staff from Social Service Agencies (SSAs) and Self-Help Groups (SHGs) to provide quality guidance, coaching and support services to their clients.The programme is designed to equip participants with enhanced knowledge, skills and competencies to:Curate training coursewareFacilitate differentiated learningGuide and coach target clientsEvaluate outcomes based on sound diagnostic assessments of their clients’ needs",https://www.sp.edu.sg/pace/courses/all-courses/course-details/specialist-diploma-in-coaching-guidance-facilitation-skills
2024,Specialist Diploma in Cyber Security Management,"With the proliferation of computers and mobile devices, the need for security is rapidly gaining significance where confidential information and critical infrastructure face risks of being hacked. Malware, social engineering, infrastructure destruction, cyberterrorism, system and application exploits are threatening individuals and corporations daily. If these threats are not mitigated, there would be disastrous consequences.Singapore government understands the importance of managing these security threats; hence announced the latest National Cyber Security Masterplan 2018 with one of the key areas of focus on growing the country’s pool of cyber security experts.Our Specialist Diploma course in Cyber Security Management is designed to train working IT professionals in the important areas of cyber security in response to the Masterplan.Participants are required to bring computer Notebook when attending lessons, as you may need it to access the e-learning materials, writing reports, etc.The course is designed to teach students essential technical skills to secure computer and network resources and to handle cyber range exercises. Students will also learn how to apply the principles and practices of infocomm security management, and to carry out the forensics process in computers and mobile devices.",https://www.sp.edu.sg/pace/courses/all-courses/course-details/specialist-diploma-in-cyber-security-management
2024,Diploma in Engineering (Control and Automation),"The course aims to train participants in the areas of instrumentation, automation and control. They will be equipped with the practical skills and knowledge in domains that include electrical and electronic engineering, Programmable Logic Controllers, Robotics and Digital Manufacturing Technology. This will allow them to work in areas like maintenance, process control, production and development in a wide range of industries, including manufacturing, petrochemical, pharmaceutical, food processing, oil and gas, and power.",https://www.sp.edu.sg/pace/courses/all-courses/course-details/diploma-in-engineering-(control-and-automation)
2024,Specialist Diploma in Full Stack Web Development,"Singapore’s move towards a digital economy and a Smart Nation will bring many new opportunities and good jobs for all Singaporeans. The Infocomm Media 2025 Master Plan has highlighted that software development is one of the key job areas that requires manpower. To ensure that every Singaporean will be ready to take advantage of such opportunities, the government has launched initiatives such as skills future to help all adults, upskill and reskill themselves in digital and technological skills.This course, Specialist Diploma in Full Stack Web Development (NSFSW) will provide an opportunity for participants to upskill and reskill themselves in web development technology.Participants will learn modern web technologies such as Progressive Web Apps (PWAs), React JS, React Native and Node.js to deliver optimised and reliable web solutions. This course focuses on using one programming language, JavaScript, to develop both the front-end and back-end. Participants will specialise using this one standard language from front-end to back-end. Effectively, participants just need to learn one way of creating applications and subsequently utilise their code and skillsets to create applications for any deployment target. Learning JavaScript is a crucial skill for any web developer, as it is one of the most popular programming languages.At the end of this course, participants will be able to develop responsive web applications with web services support from the back-end and integrate both the front-end and back-end before hosting it on the cloud.Participants are required to bring a computer notebook when attending lessons, as you may need it to access the e-learning materials, write reports, etc.This course aims to train participants in the current technologies of full stack web application development. The 3 focused areas are:Responsive web design and user interaction design.Front-end and back-end development, including persistent storage.Design, develop and deploy a full stack web application.",https://www.sp.edu.sg/pace/courses/all-courses/course-details/specialist-diploma-in-full-stack-web-development
2024,Specialist Diploma in Operational Technology Cybersecurity (Ethical Hacking and Incident Response),"This course aims to develop participants with the competency required for secured deployment of an industrial control systems (ICS) in Critical Information Infrastructure (CII), including power, transportation, oil & refinery sectors.Participants will learn in-depth technical knowledge on offensive techniques used by attackers to compromise Operational Technology (OT) systems and to propose solutions for cyber security as well as responding to breach in cyber security for such critical systems.",https://www.sp.edu.sg/pace/courses/all-courses/course-details/specialist-diploma-in-operational-technology-cybersecurity-(ethical-hacking-and-incident-response)
2024,Specialist Diploma in Data Protection and AI Governance,"Following the passing of the Personal Data Protection (Amendment) Bill in parliament on Nov 2020, companies are recruiting Data Protection Officer (DPO) to safeguard the company’s data.To meet the demand for DPO, the School of Computing (SoC) is launching a Specialist Diploma in Data Protection and AI Governance course to train graduates the necessary skills and knowledge in the area of data protection, data innovation and AI Governance. These skills would help their company to strengthen the company’s data protection practices and to uncover any operational risks, threats and vulnerabilities in a data-driven economy.The Specialist Diploma in Data Protection and AI Governance is a part-time course which typically takes about one year to complete and is conducted via a hybrid teaching mode comprising 70% face-to-face and 30% e-learning sessions. It is suitable for Degree or Diploma holders who wish to be a Data Protection Officer (DPO) or double-hat as a DPO.This course aims to provide training and awareness in Data Protection including developing a Data Protection Management Programme, addressing business risks, managing cyber and data breach incidents and developing stakeholder engagement plan.In addition, the course provides training in Data Innovation including modules such as Data Ethics, Data Sharing, Design Thinking and Data Protection by Design and AI Governance. The Design Thinking and Data Protection by Design module trains students to design an innovative digital solution incorporating good data protection practices.The course curriculum is aligned with the DPO Competency Framework and Training Roadmap and it prepares graduates of the specialist diploma for DPO job functions and work responsibilities in the exciting field of data protection and data innovation.",https://www.sp.edu.sg/pace/courses/all-courses/course-details/specialist-diploma-in-data-protection-ai-governance
2024,Diploma in Design (Interior Design),"SP's School of Architecture & Built Environment (ABE) is pleased to introduce our new Diploma in Design (Interior Design). This course provides an opportunity for ITE graduates and other working adults without any tertiary qualification to upgrade themselves academically as part of the journey of being a life-long learner. This part-time evening course can be completed in two-and-a-half years.Participants are required to bring computer notebook when attending lessons, as you may need it to access the e-learning materials, writing reports, etc.The course aims to provide a broad based education in Interior Design, providing graduates with research and conceptual skills to investigate, think, ideate, interpret and conceptualise spaces and its accompanying experience. Technically, students are exposed to material selection and detailing, as well as be equipped with communicative skills, ranging from drawing, technical drafting standards and conventions to Computer Aided Design [CAD] and Building Information Modelling [BIM] skills. Students would also be introduced to Project Management and its accompanying tools.",https://www.sp.edu.sg/pace/courses/all-courses/course-details/diploma-in-design-(interior-design)
2024,Diploma in Engineering (Power Engineering),"The Diploma in Engineering (Power Engineering) is to equip participants to work competently in the areas of electrical installations, power transmission and distribution, as well as power system operation and protection. This course is suitable for participants who intent to work in industries that include building electrical services, facility maintenance, transportation, port, manufacturing, energy and chemicals, marine and offshore.",https://www.sp.edu.sg/pace/courses/all-courses/course-details/diploma-in-engineering-(power-engineering)
2024,Specialist Diploma In Cloud Computing (DevOps),The Specialist Diploma in Cloud Computing (DevOps) - aims to equip participants with the following critical knowledge and skills in Cloud Computing:Hands-on practical experience in Cloud Computing fundamentals.Training in developing cloud-native applications.,https://www.sp.edu.sg/pace/courses/all-courses/course-details/specialist-diploma-in-cloud-computing-(devops)
2024,Diploma in Design (Visual Communication),"SP's Media, Arts & Design School is pleased to introduce our new Diploma in Design (Visual Communication). This diploma comprising of 5 Modular Certificate (MC) courses, would provide pathways for those who are working or intend to work in Brand Design, Packaging Design, Web Design and Advertising.Participants are required to bring computer notebook when attending lessons, as you may need it to access the e-learning materials, writing reports, etc.The main objective of the course is to equip students with the concepts and practice of design as a communication language and creative ideation to establish an innovative experience with integration of various contemporary and new media, with emphasis on sensorial media channels in communication design.",https://www.sp.edu.sg/pace/courses/all-courses/course-details/diploma-in-design-(visual-communication)
2024,Specialist Diploma in Cloud Computing (Architecture),"This programme aims to develop participants with the competency required to build Cloud based infrastructures and Cloud Native solutions that enable emerging technology area such as Artificial Intelligence, IoT and Data Analytics to perform end to end digital transformation, from conception to delivery. Graduates from this programme will be able to:architect and deploy secure and robust applications on Cloud technologies;define a Cloud solution using architectural design principles based on customer requirements; andoffer implementation guidance to the organization throughout the life cycle of the project.",https://www.sp.edu.sg/pace/courses/all-courses/course-details/specialist-diploma-in-cloud-computing-(architecture)
2024,Diploma (Conversion) in Computer Networking,"Rapid advances in Internet technologies and applications, and the subsequent proliferation of economic activity on the Internet have ushered in the digital age where virtually every organization wants to leverage this massive and ubiquitous public technology infrastructure to create new value for its stakeholders. With the advancement of computer technology coupled with pervasive use of computers, and in part to support the Singapore’s Smart Nation vision, there is a need for personnel trained in computer networking.In the survey on Infocomm Media Manpower conducted by the Infocomm Media Development Authority (IMDA) in 2018, a Network and Infrastructure professional is one of the most in-demand role, accounting for 17% of the total demand for Infocomm professionals. Enterprises have projected that the demand for Networks & Infrastructure-related roles will grow by 2,300 in the period of 2018 – 2020.The Diploma (Conversion) in Computer Networking offered by the School of EEE seeks to address this industrial demand. The course intends to train and equip participants with the practical knowledge and skills in administrating the Enterprise IT Network and Systems.The course aims to teach participants to:Understand the concepts in data communication and the role of computer network equipment like routers and switches.Design, configure and troubleshoot computer networks.Setup, configure, operate and maintain servers on a computer network.Students will be enrolled into the Cisco Networking Academy and takes modules in the CCNA course to prepare them for the Cisco Certified Network Associate (CCNA) professional certification.Participants are required to bring their personal computer notebook when attending lessons, as they may need it to access e-learning materials, run simulation software, write reports, etc.This course aims to introduce students to the principles, concepts and techniques in managing computer network equipment and servers. The networking modules will provide students with the basic concepts in data communication, and an understanding of computer network equipment like routers and switches, and their configuration. Students will also be equipped with network troubleshooting skills and the ability to implement network and security control. Internetworking technologies of Wide Area Network (WAN) communication protocols and configuration are also covered in the course. The Network Server Administration module will concentrate on setting up and maintaining important services running on the Enterprise network. All modules are taught with extensive hands-on sessions as well as theoretical discussions.",https://www.sp.edu.sg/pace/courses/all-courses/course-details/diploma-(conversion)-in-computer-networking
2024,Specialist Diploma in Energy Efficiency & Management,"The electricity industry in Singapore was de-regulated, thus giving many more options to the industrial and in time also for residential consumers. This was expected translate into more innovative and market driven energy products for consumers like competitive energy prices and energy efficient devices, etc. The Energy Conservation Act will be updated and in force to introduce minimum energy management standards for large energy users in the industry sector with effective from FY2013.Specialist Diploma in Energy Efficiency and Management (SEEM) is designed to develop the technical skills and competence of engineering professionals needed to manage and track energy usage within the organization they serve. It gives a thorough understanding of the key energy issues in the building sector.Participants are required to bring computer Notebook when attending lessons, as you may need it to access the e-learning materials, writing reports, etc.",https://www.sp.edu.sg/pace/courses/all-courses/course-details/specialist-diploma-in-energy-efficiency-management
2024,Specialist Diploma in Nutrition and Exercise Science,"This diploma course aims to provide learners with an integrated education focusing on nutrition and exercise science so that students can acquire a holistic education in health and fitness. It also enhances occupational and personal competencies for better career enhancement in the health and fitness industry.The course aims to provide the participants with the:Understanding of the science of nutrition and the importance of nutritional adequacy and balance for optimal growth and health. Understanding of the role of nutrition in disease prevention and management.Overview and appreciation of the underlying principles and practice involved in the evolving field of exercise and sports nutrition.Understanding of the physiological principles that explain how the human body functions during exercise.Ability to apply the knowledge of exercise physiology in the fitness and performance arena to attain general wellness levels and achieve maximum performance in sport or exercise.Understanding of the process of evaluating and diagnosing movement inefficiencies, thereby improving movement quality and reduce injuries.",https://www.sp.edu.sg/pace/courses/all-courses/course-details/specialist-diploma-in-nutrition-exercise-science
2024,Specialist Diploma in Digital Content Marketing,"In our digitally connected world, businesses have increased digital requirements. Creative media specialist jobs (including online video content creation) has been projected to grow by 4,700 in the next three years (IMDA Manpower Survey, 2018).To address these industry needs, the School of Media, Arts and Design is pleased to introduce our new Specialist Diploma in Digital Content Marketing (SD-DCM), jointly offered by Singapore Polytechnic (SP) and Singapore University of Social Sciences (SUSS).Key Features of the SD-DCM:SD with pathway to SUSS minor (subject to SUSS’ entry requirements): Suitable for driven participants who want to kick-start their career and also desire to further their university education at the same timeFlexibility for companies and participants: The programme provides flexibility to full-time employees through the use of blended learning so night classes take place only once or twice a weekThe SD-DCM is designed to equip participants with skills and knowledge in Digital Content Marketing.By the end of the programme, participants will be able to:Produce simple digital content for businessesDevelop a digital content strategy and use digital/social media tools and techniques for marketingDeepen skills in one of the two areas: Branding using Social Media, and Social Media Metrics and Analytics",https://www.sp.edu.sg/pace/courses/all-courses/course-details/specialist-diploma-in-digital-content-marketing
2024,Specialist Diploma in Operational Technology Cybersecurity (Industrial Control Systems),"This course aims to develop students with the competency required for a secured deployment of Industrial Control Systems (ICS) in manufacturing facilities and in critical infrastructure. Upon completing the course, students will be able to make a differentiation between Operation Technology (OT) and Information Technology (IT) cyber-security, and be equipped with critical knowledge and skills to identify cyber threats to ICS and propose solutions for cyber security.",https://www.sp.edu.sg/pace/courses/all-courses/course-details/specialist-diploma-in-operational-technology-cybersecurity-(industrial-control-systems)
2024,Diploma in Engineering (Control & Automation),"The Diploma in Engineering (Control and Automation) (DECA) focuses on electrical and electronic engineering that is applied in the area of automation, process control and instrumentation and aims to equip adult learners with the knowledge and skills required to undertake diploma-level jobs in the manufacturing, process and automation industries.In response to the evolving needs of the industry, this course has been brought up-to-date with the introduction of 3 new modules:Artificial Intelligence for Automation, which provides the background required to understand the techniques involved in Artificial Intelligence (AI) and Machine Learning (ML) and equip students with knowledge of how to implement AI and ML systems and solutions for industrial automation systems.Smart Sensors & Actuators, which provides students with a broad knowledge of various types of smart sensors and an in-depth understanding of the principle & application of smart sensors & actuators in automation and process industries.Digital Manufacturing Technology, which covers the various components and technologies in Digital Manufacturing (Industry 4.0).Participants in this course will have the opportunity to gain hands-on training in our laboratories, which are equipped with facilities from leading industrial suppliers including Siemens, Yokogawa, Endress+Hauser, Pepperl+Fuchs, ABB, Bosch, Festo and National Instruments.The Diploma in Engineering (Control & Automation) complies with the revised CET Diploma Framework, which specifies that each CET diploma course will consist consists of five 180-hour modular certificates (MC). Each MC is designed to be completed in one academic semester and is made up of 150 contact hours and 30 flexible learning hours. The flexible learning hours are non-timetabled curriculum hours set aside for self-paced learning activities like eLearning or project assignments.Participants are required to bring their computer notebook when attending lessons, as they may need it to access the e-learning materials, write reports, etc.",https://www.sp.edu.sg/pace/courses/all-courses/course-details/diploma-in-engineering-(control-automation)
